{
  "$schema": "https://json-schema.org/draft/2020-12/schema",
  "type": "object",
  "additionalProperties": false,
  "properties": {
    "schema_version": {
      "const": "1.0"
    },
    "id": {
      "type": "string",
      "pattern": "^BUG-[0-9]{3,}$"
    },
    "project_id": {
      "type": "string",
      "pattern": "^PRJ-[0-9]{3,}$"
    },
    "owner_batch": {
      "enum": [
        "B01",
        "B02",
        "B03",
        "B04",
        "B05",
        "B06"
      ]
    },
    "title": {
      "type": "string",
      "minLength": 1
    },
    "status": {
      "enum": [
        "open",
        "triaged",
        "fixing",
        "ready_for_retest",
        "verified",
        "closed",
        "reopened"
      ]
    },
    "revision": {
      "type": "integer",
      "minimum": 1
    },
    "approval_ref": {
      "type": [
        "string",
        "null"
      ]
    },
    "severity": {
      "type": "string"
    },
    "requirement_ids": {
      "type": "array",
      "items": {
        "type": "string"
      }
    },
    "source_sha": {
      "type": "string",
      "pattern": "^[0-9a-f]{40}$"
    },
    "reproduction_steps": {
      "type": "array",
      "items": {
        "type": "string"
      }
    },
    "expected_behavior": {
      "type": "string"
    },
    "actual_behavior": {
      "type": "string"
    },
    "evidence_ids": {
      "type": "array",
      "items": {
        "type": "string"
      }
    }
  },
  "required": [
    "schema_version",
    "id",
    "project_id",
    "owner_batch",
    "title",
    "status",
    "revision",
    "severity",
    "requirement_ids",
    "source_sha",
    "reproduction_steps",
    "expected_behavior",
    "actual_behavior",
    "evidence_ids"
  ],
  "allOf": [
    {
      "properties": {
        "id": {
          "pattern": "^BUG-[0-9]{3,}$"
        },
        "owner_batch": {
          "const": "B06"
        }
      }
    }
  ]
}
